<?xml version="1.0" encoding="UTF-8"?>
<!--Sample XML file generated by XMLSpy v2013 sp1 (x64) (http://www.altova.com)-->
<medicine xsi:noNamespaceSchemaLocation="Medicine.xsd" xmlns:xsi="http://www.w3.org/2001/XMLSchema-instance">
	<drug id="ID_1" country="USA">
		<name>Imet</name>
		<pharm>Google</pharm>
		<group>PAINKILLERS</group>
		<analogs>Ibuprofen</analogs>
		<analogs>Kitanov</analogs>
		<versions number="1" consistence="TABLETS" pharm="Google">
			<certificate number="aaa1b" issuedate="2008-07" expdate="2013-12" reg_organization="Rambler"/>
			<package top="glass" amount="150" price="58.60"/>
			<dosage value="3 drops" period="1 time a day"/>
		</versions>
		<versions number="2" consistence="CAPSULES" pharm="Epam">
			<certificate number="adf55" issuedate="2006-12" expdate="2014-10" reg_organization="Rambler"/>
			<package top="plastic" amount="30" price="62.80"/>
			<dosage value="2 capsules" period="2 times a day"/>
		</versions>
	</drug>
	<drug id="ID_4" country="Russia">
		<name>Eretromicin</name>
		<pharm>Yandex</pharm>
		<group>ANTIBIOTICS </group>
		<analogs>Tetraciclin</analogs>
		<analogs>Biocicline</analogs>
		<versions number="1" consistence="POWDERS" pharm="Yandex">
			<certificate number="fff123f" issuedate="2008-12" expdate="2018-06" reg_organization="Rambler"/>
			<package top="paper" amount="60" price="59.60"/>
			<dosage value="3 g" period="3 times a day"/>
		</versions>
		<versions number="2" consistence="DROPS" pharm="Epam">
			<certificate number="ggg34g" issuedate="2008-07" expdate="2015-04" reg_organization="Rambler"/>
			<package top="metal" amount="150" price="90.20"/>
			<dosage value="7 drops" period="4 times a day"/>
		</versions>
	</drug>
</medicine>
